{
  "schema_version": "opennori/build-vs-buy-v1",
  "id": "cli-subcommand-surface-reuse-node-parseargs-before-framework",
  "created_at": "2026-06-12T07:28:28.730Z",
  "area": "cli-subcommand-surface",
  "need": "Keep the growing opennori command surface understandable while preserving deterministic JSON output for agents",
  "recommendation": "reuse",
  "status": "superseded",
  "summary": "Historical decision retained for review: OpenNori previously kept node:util parseArgs and a small wrapper before the long-term TypeScript/citty baseline was confirmed.",
  "current_project": "Current project still contains the legacy src/cli.js surface, but package.json now includes citty and the confirmed baseline requires incremental TypeScript command modules.",
  "standard_library": "node:util parseArgs remains useful for transitional token compatibility but is no longer the preferred long-term subcommand architecture.",
  "official_sdk": "No official OpenNori SDK applies.",
  "open_source": "citty 0.2.2 MIT is now the active baseline choice; commander and cac remain fallback candidates if citty integration is blocked.",
  "self_build_reason": "",
  "superseded_by": "cli-command-layer-adopt-citty-for-long-term-typescript-cli",
  "superseded_reason": "The confirmed TypeScript agent state CLI baseline now chooses citty as the long-term command layer instead of treating parseArgs as sufficient for the subcommand surface."
}
