{
  "schema_version": "opennori/build-vs-buy-v1",
  "id": "cli-支持-architecture-baseline-命令入口和-agent-readable-状态",
  "created_at": "2026-06-12T00:15:07.516Z",
  "area": "cli",
  "need": "支持 Architecture Baseline 命令入口和 agent-readable 状态",
  "recommendation": "self-build",
  "summary": "当前阶段先沿用现有单文件 CLI 命令分发补齐产品状态对象，避免在架构修复前引入 CLI 框架迁移风险；后续 CLI 架构修复必须重新评估 commander/citty/cac 等成熟库。",
  "current_project": "当前项目只有 Node ESM、node:test、src/cli.js 手写 argValue/hasFlag，尚未引入 CLI 框架。",
  "standard_library": "Node.js 没有完整子命令框架。",
  "official_sdk": "无官方 SDK。",
  "open_source": "可评估 commander、citty、cac；本次不迁移是为了先建立 Architecture Baseline 状态层。",
  "self_build_reason": "这是 OpenNori 产品域状态命令的短期落盘，不是长期 CLI 架构结论；目标 baseline 已要求后续架构修复前重新做 build-vs-buy。"
}
