{
  "schema_version": "opennori/build-vs-buy-v1",
  "id": "mcp-readonly-context-server-baseline",
  "created_at": "2026-06-23T05:56:36.997Z",
  "area": "mcp-context-export",
  "need": "Define how OpenNori may expose goal, acceptance, profile, architecture, evidence, report, and dashboard context to agent clients through MCP without creating a second state layer or duplicating the CLI.",
  "recommendation": "reuse",
  "status": "active",
  "summary": "Use the official Model Context Protocol TypeScript SDK with read-only resources first. The current implementation registers only context, snapshot, and doctor resources over stdio; no MCP write tools are registered.",
  "current_project": "OpenNori already exposes deterministic state through CLI commands, .opennori JSON files, context export, dashboard snapshots, and packaged Skills. MCP is currently an integration surface, not a replacement runtime.",
  "standard_library": "Node stdio and HTTP primitives can transport bytes, but they do not implement MCP capability negotiation, tool/resource schemas, transports, or client expectations.",
  "official_sdk": "Context7 on 2026-06-23 identified /modelcontextprotocol/typescript-sdk as the high-reputation SDK. The available npm package is @modelcontextprotocol/sdk 1.29.0; its exported server API includes McpServer.registerResource(...) and StdioServerTransport.",
  "open_source": "@modelcontextprotocol/sdk is the protocol implementation to reuse. It carries transitive HTTP/OAuth/server dependencies even though OpenNori currently uses only stdio resources; this is accepted because protocol negotiation and transport framing should not be handwritten. Hono remains the dashboard kernel HTTP framework, but dashboard transport is not MCP and must not become an agent write authority.",
  "self_build_reason": "",
  "superseded_by": "",
  "superseded_reason": ""
}
