{
  "schema_version": "opennori/build-vs-buy-v1",
  "id": "architecture-profile-review-surface",
  "created_at": "2026-06-12T02:49:16.855Z",
  "area": "architecture-profile",
  "need": "Expose reviewable Architecture Profile details before baseline confirmation",
  "recommendation": "self-build",
  "summary": "Reuse OpenNori's existing architecture profile state and CLI JSON surface to expose applies_to, sources, principles, checks, preferred libraries, avoid boundaries, and build-vs-buy policy before baseline confirmation.",
  "current_project": "src/architecture.js already owns built-in and project Architecture Profiles; src/cli.js already exposes opennori architecture profiles.",
  "standard_library": "Node fs/path are sufficient for reading project-local profile JSON.",
  "official_sdk": "No official SDK applies to OpenNori product-state semantics.",
  "open_source": "Registry/schema libraries would be heavier than needed for this deterministic profile review surface; schema validation can be reconsidered if profile schemas grow.",
  "self_build_reason": "Architecture Profile review is OpenNori product semantics and should reuse the existing Architecture Baseline domain model without adding a generic registry dependency."
}
