{
  "schema_version": "opennori/build-vs-buy-v1",
  "id": "protocol-state-validation-ajv-runtime-public-json-schema",
  "created_at": "2026-06-12T08:08:19.004Z",
  "area": "protocol-state-validation",
  "need": "Validate OpenNori persisted state with public JSON Schema and runtime Ajv checks",
  "recommendation": "reuse",
  "status": "active",
  "summary": "Use package-local schemas/*.schema.json as public protocol structure and Ajv 2020 runtime validation for manifest, active evidence payloads, Architecture Baseline, and build-vs-buy decisions; keep OpenNori semantic rules in domain validators.",
  "current_project": "OpenNori already writes JSON state under .opennori and has validateContract, architecture health, doctor, and build-vs-buy semantic checks; this slice adds structural validation without replacing those domain rules.",
  "standard_library": "JSON.parse validates syntax only and cannot express required object shape, enum values, or array item structure.",
  "official_sdk": "No official OpenNori SDK exists; JSON Schema is the relevant open standard for shareable protocol structure.",
  "open_source": "Ajv is already selected in package.json and supports JSON Schema 2020-12; Zod/Valibot remain alternatives for TypeScript-first authoring but are not the public protocol format.",
  "self_build_reason": "",
  "superseded_by": "",
  "superseded_reason": ""
}
