{
  "schema_version": "opennori/build-vs-buy-v1",
  "id": "protocol-state-validation-reuse-json-schema-validator-when-contracts-grow",
  "created_at": "2026-06-12T05:13:10.309Z",
  "area": "protocol-state-validation",
  "need": "Validate OpenNori contract, evidence, manifest, architecture profile, and baseline state without long-term handwritten structural checks",
  "recommendation": "reuse",
  "summary": "OpenNori should prefer JSON Schema-style validation for project-state contracts once these schemas grow beyond small local invariants; Ajv is the leading MIT JSON Schema validator candidate, while Zod/Valibot remain candidates when TypeScript-first authoring becomes valuable. The current release keeps small product-domain checks local but records that schema validation is not a default self-build area.",
  "current_project": "Current project has small local validators in src/core.js and src/architecture.js, no runtime dependencies, and tests covering contract/profile/baseline health.",
  "standard_library": "Node provides JSON.parse and syntax errors but no JSON Schema or structural validation engine.",
  "official_sdk": "No official OpenNori SDK exists; JSON Schema is the relevant open standard rather than a vendor SDK.",
  "open_source": "Ajv 8.20.0 MIT, Zod 4.4.3 MIT, Valibot 1.4.1 MIT were checked on npm on 2026-06-12.",
  "self_build_reason": ""
}
